Hotels,Ratings,Price,Link,Descriptions
Primus Valencia,"8,2",¬ 119,https://www.booking.com/hotel/es/primus-valencia.es.html?label=gen173nr-1FCAEoggI46AdIClgEaEaIAQGYAQq4AQfIAQ_YAQHoAQH4AQKIAgGoAgO4ApfP860GwAIB0gIkOWNjMzhhYzktZmY4ZC00ZTYxLWE1OTgtMzU5MzQ4ZWY3ZGQ22AIF4AIB&aid=304142&ucfs=1&arphpl=1&checkin=2024-06-14&checkout=2024-06-15&dest_id=-406131&dest_type=city&group_adults=2&req_adults=2&no_rooms=1&group_children=0&req_children=0&hpos=9&hapos=9&sr_order=popularity&srpvid=48115b9ef1c50167&srepoch=1706878918&all_sr_blocks=33187101_88154952_0_2_0&highlighted_blocks=33187101_88154952_0_2_0&matching_block_id=33187101_88154952_0_2_0&sr_pri_blocks=33187101_88154952_0_2_0__11925&from_sustainable_property_sr=1&from=searchresults#hotelTmpl,"Este hotel ultramoderno se encuentra a solo 600 metros de la impresionante Ciudad de las Artes y las Ciencias de Valencia. Además, cuenta con un spa, gimnasio, piscina exterior disponible todo el año y habitaciones elegantes con TV de plasma vía satélite y WiFi gratuita.

Las habitaciones del Valencia Primus están insonorizadas y cuentan con aire acondicionado, suelo de madera, una decoración moderna y luminosa, escritorio y caja fuerte para un ordenador portátil.

Por un suplemento, los huéspedes podrán acceder al completo spa del hotel, provisto de piscina dinámica, piscina de agua fría, bañera de hidromasaje, sauna, hammam y una amplia gama de masajes y tratamientos de belleza. Se ofrece una amplia gama de masajes y tratamientos de belleza por un suplemento. También hay un centro de fitness.

El elegante restaurante del hotel sirve cocina tradicional mediterránea con un toque moderno. El alojamiento dispone de una terraza al aire libre, así como de un bar-cafetería con vistas al encantador jardín.

El centro comercial Aqua Multiespacio está justo frente al Primus Valencia. Hay un autobús que para a 75 metros y comunica con el centro de la ciudad y las playas."
Olympia Consul del Mar,"7,9",¬ 102,https://www.booking.com/hotel/es/casual-valencia-de-las-artes.es.html?label=gen173nr-1FCAEoggI46AdIClgEaEaIAQGYAQq4AQfIAQ_YAQHoAQH4AQKIAgGoAgO4ApfP860GwAIB0gIkOWNjMzhhYzktZmY4ZC00ZTYxLWE1OTgtMzU5MzQ4ZWY3ZGQ22AIF4AIB&aid=304142&ucfs=1&arphpl=1&checkin=2024-06-14&checkout=2024-06-15&dest_id=-406131&dest_type=city&group_adults=2&req_adults=2&no_rooms=1&group_children=0&req_children=0&hpos=10&hapos=10&sr_order=popularity&srpvid=48115b9ef1c50167&srepoch=1706878918&all_sr_blocks=53805601_385093741_0_2_0&highlighted_blocks=53805601_385093741_0_2_0&matching_block_id=53805601_385093741_0_2_0&sr_pri_blocks=53805601_385093741_0_2_0__10200&from=searchresults#hotelTmpl,"El Olympia Consul del Mar se encuentra a 15 minutos a pie de la Ciudad de las Artes y las Ciencias. Ofrece WiFi gratuita.

Las habitaciones son amplias y disponen de aire acondicionado, minibar, caja fuerte y TV de pantalla plana. El baño privado incluye secador de pelo y artículos de aseo gratuitos. Una de las habitaciones está adaptada para personas con movilidad reducida.

Hay numerosos bares, restaurantes y tiendas en los alrededores del Olympia Consul del Mar. El centro histórico de Valencia, situado a 3 km, también alberga muchos sitios para comer y animados locales de ocio nocturno.

La estación de metro Amistat, situada a 10 minutos a pie del hotel, ofrece conexiones con el resto de la ciudad. Se encuentra a 3 km del puerto de Valencia y de la playa. El aeropuerto de Valencia queda a 20 minutos en coche. Se facilita aparcamiento privado por un suplemento."
Casual de la Música Valencia,"6,9",¬ 90,https://www.booking.com/hotel/es/florida-valencia.es.html?label=gen173nr-1FCAEoggI46AdIClgEaEaIAQGYAQq4AQfIAQ_YAQHoAQH4AQKIAgGoAgO4ApfP860GwAIB0gIkOWNjMzhhYzktZmY4ZC00ZTYxLWE1OTgtMzU5MzQ4ZWY3ZGQ22AIF4AIB&aid=304142&ucfs=1&arphpl=1&checkin=2024-06-14&checkout=2024-06-15&dest_id=-406131&dest_type=city&group_adults=2&req_adults=2&no_rooms=1&group_children=0&req_children=0&hpos=11&hapos=11&sr_order=popularity&srpvid=48115b9ef1c50167&srepoch=1706878918&all_sr_blocks=27313002_88450967_0_2_0&highlighted_blocks=27313002_88450967_0_2_0&matching_block_id=27313002_88450967_0_2_0&sr_pri_blocks=27313002_88450967_0_2_0__9000&from=searchresults#hotelTmpl,"El Casual Valencia de la Música está situado en el centro de Valencia y a solo 200 metros de la estación de tren principal, y cuenta con habitaciones con aire acondicionado.

Este hotel dispone de máquinas expendedoras de café y aperitivos. El Casual Valencia de la Música está cerca de muchos bares y restaurantes debido a su proximidad al centro histórico y comercial.

El Casual Valencia de la Música ofrece recepción 24 horas y consigna de equipaje.

La plaza de toros de Valencia se encuentra a 200 metros y la catedral de Valencia está a menos de 10 minutos a pie."
Quart Youth Hostel & Apartments,"7,7",¬ 61,https://www.booking.com/hotel/es/quart-youth-hostel.es.html?label=gen173nr-1FCAEoggI46AdIClgEaEaIAQGYAQq4AQfIAQ_YAQHoAQH4AQKIAgGoAgO4ApfP860GwAIB0gIkOWNjMzhhYzktZmY4ZC00ZTYxLWE1OTgtMzU5MzQ4ZWY3ZGQ22AIF4AIB&aid=304142&ucfs=1&arphpl=1&checkin=2024-06-14&checkout=2024-06-15&dest_id=-406131&dest_type=city&group_adults=2&req_adults=2&no_rooms=1&group_children=0&req_children=0&hpos=12&hapos=12&sr_order=popularity&srpvid=48115b9ef1c50167&srepoch=1706878918&all_sr_blocks=47641801_88209789_0_2_0&highlighted_blocks=47641801_88209789_0_2_0&matching_block_id=47641801_88209789_0_2_0&sr_pri_blocks=47641801_88209789_0_2_0__6124&from=searchresults#hotelTmpl,"El Quart Youth Hostel, situado a 300 metros de las torres medievales de Quart, ofrece consigna de equipaje y conexión WiFi gratuitas. Las habitaciones tienen taquillas individuales y adaptadores eléctricos.

Presentan una decoración moderna y cuentan con armario, ventilador de techo, camas individuales o literas, y baño compartido con ducha o bañera.

El Quart Youth Hostel sirve un desayuno buffet diario y cuenta con máquinas expendedoras de aperitivos y bebidas. También alberga una cocina compartida con tostadora, hervidor de agua y cafetera.

El Quart Youth Hostel se encuentra en el centro de la ciudad, a 5 minutos a pie del casco antiguo de Valencia, y está muy bien comunicado con la red de transporte público. A 150 metros hay una parada de autobús que lleva tanto a la Ciudad de las Artes y las Ciencias como a las playas de Valencia."
Limin Hostel Capsules,"6,2",¬ 39,https://www.booking.com/hotel/es/limin-hostel-capsules.es.html?label=gen173nr-1FCAEoggI46AdIClgEaEaIAQGYAQq4AQfIAQ_YAQHoAQH4AQKIAgGoAgO4ApfP860GwAIB0gIkOWNjMzhhYzktZmY4ZC00ZTYxLWE1OTgtMzU5MzQ4ZWY3ZGQ22AIF4AIB&aid=304142&ucfs=1&arphpl=1&checkin=2024-06-14&checkout=2024-06-15&dest_id=-406131&dest_type=city&group_adults=2&req_adults=2&no_rooms=1&group_children=0&req_children=0&hpos=13&hapos=13&sr_order=popularity&srpvid=48115b9ef1c50167&srepoch=1706878918&all_sr_blocks=966099502_369098781_2_0_0&highlighted_blocks=966099502_369098781_2_0_0&matching_block_id=966099502_369098781_2_0_0&sr_pri_blocks=966099502_369098781_2_0_0__3870&from=searchresults#hotelTmpl,"Limin Hostel Capsules está en Valencia, a 1,7 km de Playa de las Arenas, y dispone de salón de uso común, habitaciones libres de humo, wifi gratis en todo el alojamiento y terraza. El alojamiento está a unos 2,3 km de Playa de la Malvarrosa, a 12 min a pie de Puerto de Valencia y a 3,3 km de Oceanográfico. Jardín del Turia está a 3,9 km del hotel cápsula y Jardines de Monforte, a 4,1 km.

El baño compartido está equipado con ducha, artículos de aseo gratuitos y secador de pelo. En el hotel cápsula, las habitaciones tienen ropa de cama y toallas.

El personal de recepción habla inglés, español, hindi y urdú, y está siempre dispuesto a echar una mano.

Estación de tren del Norte está a 4,7 km del alojamiento, y Museo Nacional de Cerámica y Artes Santuarias González Martí está a 5,1 km. El aeropuerto (Aeropuerto de Valencia) está a 13 km."
Sweet Hotel Continental,"8,1",¬ 149,https://www.booking.com/hotel/es/continental.es.html?label=gen173nr-1FCAEoggI46AdIClgEaEaIAQGYAQq4AQfIAQ_YAQHoAQH4AQKIAgGoAgO4ApfP860GwAIB0gIkOWNjMzhhYzktZmY4ZC00ZTYxLWE1OTgtMzU5MzQ4ZWY3ZGQ22AIF4AIB&aid=304142&ucfs=1&arphpl=1&checkin=2024-06-14&checkout=2024-06-15&dest_id=-406131&dest_type=city&group_adults=2&req_adults=2&no_rooms=1&group_children=0&req_children=0&hpos=14&hapos=14&sr_order=popularity&srpvid=48115b9ef1c50167&srepoch=1706878918&all_sr_blocks=9385605_261898914_0_2_0&highlighted_blocks=9385605_261898914_0_2_0&matching_block_id=9385605_261898914_0_2_0&sr_pri_blocks=9385605_261898914_0_2_0__14900&from=searchresults#hotelTmpl,"El Hotel Continental se encuentra en el centro de Valencia, a 5 minutos a pie de la estación de tren Estació del Nord, junto a la plaza principal de la ciudad. El establecimiento ofrece recepción 24 horas y habitaciones con TV vía satélite.

El hotel sirve un desayuno continental diario en la sala de desayunos y está a 5 minutos a pie de varios restaurantes de calidad.

La terraza tiene vistas a la ciudad y está equipada con mesas y sillas.

El personal de la recepción del Continental Hotel puede facilitar información turística sobre Valencia. Las calles comerciales Colón y Poeta Querol se encuentran a menos de 5 minutos a pie del hotel."
Best Valencia Beach Flat Historic Area next to the Beach,"8,1",¬ 195,https://www.booking.com/hotel/es/best-valencia-beach-flat-historic-area-next-to-the-beach.es.html?label=gen173nr-1FCAEoggI46AdIClgEaEaIAQGYAQq4AQfIAQ_YAQHoAQH4AQKIAgGoAgO4ApfP860GwAIB0gIkOWNjMzhhYzktZmY4ZC00ZTYxLWE1OTgtMzU5MzQ4ZWY3ZGQ22AIF4AIB&aid=304142&ucfs=1&arphpl=1&checkin=2024-06-14&checkout=2024-06-15&dest_id=-406131&dest_type=city&group_adults=2&req_adults=2&no_rooms=1&group_children=0&req_children=0&hpos=15&hapos=15&sr_order=popularity&srpvid=48115b9ef1c50167&srepoch=1706878918&all_sr_blocks=845470402_351514851_2_0_0&highlighted_blocks=845470402_351514851_2_0_0&matching_block_id=845470402_351514851_2_0_0&sr_pri_blocks=845470402_351514851_2_0_0__19470&from_sustainable_property_sr=1&from=searchresults#hotelTmpl,"Best Valencia Beach Flat Historic Area next to the Beach está en Valencia, cerca de Playa de las Arenas, Playa de la Malvarrosa, y Playa de Patacona. Dispone de wifi gratis y terraza.

El alojamiento tiene aire acondicionado, cocina totalmente equipada y con zona de comedor, TV de pantalla plana y baño privado con ducha y secador de pelo. También hay nevera, microondas y fogones, además de cafetera y hervidor.

El apartamento ofrece servicio de alquiler de coches.

Puerto de Valencia está a 17 min a pie del alojamiento, y Jardín del Turia está a 4,2 km. El aeropuerto más cercano (Aeropuerto de Valencia) está a 13 km."
B&B HOTEL Valencia Ciudad de las Ciencias,"7,6",¬ 113,https://www.booking.com/hotel/es/b-and-b-valencia.es.html?label=gen173nr-1FCAEoggI46AdIClgEaEaIAQGYAQq4AQfIAQ_YAQHoAQH4AQKIAgGoAgO4ApfP860GwAIB0gIkOWNjMzhhYzktZmY4ZC00ZTYxLWE1OTgtMzU5MzQ4ZWY3ZGQ22AIF4AIB&aid=304142&ucfs=1&arphpl=1&checkin=2024-06-14&checkout=2024-06-15&dest_id=-406131&dest_type=city&group_adults=2&req_adults=2&no_rooms=1&group_children=0&req_children=0&hpos=16&hapos=16&sr_order=popularity&srpvid=48115b9ef1c50167&srepoch=1706878918&all_sr_blocks=9224201_218405286_0_2_0&highlighted_blocks=9224201_218405286_0_2_0&matching_block_id=9224201_218405286_0_2_0&sr_pri_blocks=9224201_218405286_0_2_0__11250&from_sustainable_property_sr=1&from=searchresults#hotelTmpl,"Este hotel está situado a unos 1,5 km de la impresionante Ciudad de las Artes y las Ciencias de Valencia y ofrece habitaciones modernas y WiFi gratuita. La recepción está abierta las 24 horas.

Las habitaciones son modernas y tienen TV de pantalla plana. La calefacción central y el aire acondicionado están disponibles según la temporada. El baño privado cuenta con secador de pelo. Las habitaciones se limpian todos los días.

Todos los días se sirve un variado desayuno buffet. También hay un bar en el vestíbulo.

El B&B HOTEL Valencia Ciudad de las Ciencias se encuentra a 3 km del centro de Valencia y a 5 km de la playa de Las Arenas. Feria Valencia está a 20 minutos en coche y el hospital La Fe, a 800 metros."
Hotel Dimar,"8,6",¬ 150,https://www.booking.com/hotel/es/dimar.es.html?label=gen173nr-1FCAEoggI46AdIClgEaEaIAQGYAQq4AQfIAQ_YAQHoAQH4AQKIAgGoAgO4ApfP860GwAIB0gIkOWNjMzhhYzktZmY4ZC00ZTYxLWE1OTgtMzU5MzQ4ZWY3ZGQ22AIF4AIB&aid=304142&ucfs=1&arphpl=1&checkin=2024-06-14&checkout=2024-06-15&dest_id=-406131&dest_type=city&group_adults=2&req_adults=2&no_rooms=1&group_children=0&req_children=0&hpos=17&hapos=17&sr_order=popularity&srpvid=48115b9ef1c50167&srepoch=1706878918&all_sr_blocks=9088630_198497272_0_2_0&highlighted_blocks=9088630_198497272_0_2_0&matching_block_id=9088630_198497272_0_2_0&sr_pri_blocks=9088630_198497272_0_2_0__15000&from_sustainable_property_sr=1&from=searchresults#hotelTmpl,"Este moderno hotel de diseño está situado en la plaza Cánovas de Valencia y ofrece un gimnasio y conexión Wi-Fi gratuita. Todas las habitaciones del Hotel Dimar son elegantes e incluyen set de té y café y TV de pantalla plana.

Las habitaciones del Hotel Dimar presentan una decoración elegante y cuentan con aire acondicionado, suelo de madera, minibar y baño privado con artículos de aseo y secador de pelo.

El restaurante del Hotel Dimar sirve un desayuno bufé continental y el bar ofrece bocadillos y pastas. Además, en los alrededores hay varios restaurantes y bares.

El Hotel Dimar está situado junto al jardín del Turia, a 15 minutos a pie de la catedral de Valencia y a 600 metros de la estación de metro de Colón. La famosa Ciudad de las Artes y las Ciencias se halla a solo 1,5 km."
Port Feria Valencia,"8,0",¬ 81,https://www.booking.com/hotel/es/port-valencia-feria.es.html?label=gen173nr-1FCAEoggI46AdIClgEaEaIAQGYAQq4AQfIAQ_YAQHoAQH4AQKIAgGoAgO4ApfP860GwAIB0gIkOWNjMzhhYzktZmY4ZC00ZTYxLWE1OTgtMzU5MzQ4ZWY3ZGQ22AIF4AIB&aid=304142&ucfs=1&arphpl=1&checkin=2024-06-14&checkout=2024-06-15&dest_id=-406131&dest_type=city&group_adults=2&req_adults=2&no_rooms=1&group_children=0&req_children=0&hpos=18&hapos=18&sr_order=popularity&srpvid=48115b9ef1c50167&srepoch=1706878918&all_sr_blocks=9285201_372552674_2_2_0&highlighted_blocks=9285201_372552674_2_2_0&matching_block_id=9285201_372552674_2_2_0&sr_pri_blocks=9285201_372552674_2_2_0__8090&from_sustainable_property_sr=1&from=searchresults#hotelTmpl,"El Port Feria Valencia, situado cerca del Centro de Convenciones Feria Valencia y muy cerca del centro de la ciudad, es la mejor opción para descubrir Valencia gracias a sus excelentes conexiones con todos las zonas de la ciudad, sus completas instalaciones y sus servicios de calidad. Este hotel moderno está muy bien comunicado con el centro histórico, la plaza del Ayuntamiento, el aeropuerto y la Ciudad de las Artes y las Ciencias.

El Port Feria Valencia ofrece servicios excelentes y prácticos. Alberga un restaurante a la carta con platos mediterráneos y especialidades valencianas. Cuenta con piscina al aire libre, terraza solárium, gimnasio, restaurante y cafetería. Hay WiFi gratuita en todas las zonas del hotel. El aparcamiento y el servicio de enlace con el aeropuerto conllevan un suplemento.

El Port Feria Valencia ofrece habitaciones espléndidas con todas las comodidades necesarias para garantizar una estancia inmejorable. Cuenta con 3 salas para reuniones con una capacidad máxima de 78 personas, entre otros servicios e instalaciones.

La estación de metro de Benimàmet queda a 400 metros. El hotel está bien comunicado con las principales carreteras. El aeropuerto de Valencia se encuentra a 10 minutos en coche."
Ad Hoc Carmen,"8,4",¬ 139,https://www.booking.com/hotel/es/ad-hoc-carmen.es.html?label=gen173nr-1FCAEoggI46AdIClgEaEaIAQGYAQq4AQfIAQ_YAQHoAQH4AQKIAgGoAgO4ApfP860GwAIB0gIkOWNjMzhhYzktZmY4ZC00ZTYxLWE1OTgtMzU5MzQ4ZWY3ZGQ22AIF4AIB&aid=304142&ucfs=1&arphpl=1&checkin=2024-06-14&checkout=2024-06-15&dest_id=-406131&dest_type=city&group_adults=2&req_adults=2&no_rooms=1&group_children=0&req_children=0&hpos=19&hapos=19&sr_order=popularity&srpvid=48115b9ef1c50167&srepoch=1706878918&all_sr_blocks=117327002_266101809_2_0_0&highlighted_blocks=117327002_266101809_2_0_0&matching_block_id=117327002_266101809_2_0_0&sr_pri_blocks=117327002_266101809_2_0_0__13900&from_sustainable_property_sr=1&from=searchresults#hotelTmpl,"El hotel Ad Hoc Carmen está situado en el centro histórico de Valencia, a solo 400 metros de la catedral de la ciudad, y ofrece servicio de recepción las 24 horas y conexión WiFi gratuita en todas las instalaciones.

Las habitaciones de este hotel cuentan con mobiliario sencillo y moderno y están equipadas con aire acondicionado, armario, calefacción, TV de pantalla plana, teléfono, y baño privado con artículos de aseo gratuitos.

El Ad Hoc Carmen ofrece información turística de la zona y servicio de alquiler de bicicletas.

La playa de la Malvarrosa se encuentra a 6 km y la reserva natural del Parque de la Albufera, a 30 minutos en coche."
Hotel Turia,"8,1",¬ 125,https://www.booking.com/hotel/es/turia.es.html?label=gen173nr-1FCAEoggI46AdIClgEaEaIAQGYAQq4AQfIAQ_YAQHoAQH4AQKIAgGoAgO4ApfP860GwAIB0gIkOWNjMzhhYzktZmY4ZC00ZTYxLWE1OTgtMzU5MzQ4ZWY3ZGQ22AIF4AIB&aid=304142&ucfs=1&arphpl=1&checkin=2024-06-14&checkout=2024-06-15&dest_id=-406131&dest_type=city&group_adults=2&req_adults=2&no_rooms=1&group_children=0&req_children=0&hpos=20&hapos=20&sr_order=popularity&srpvid=48115b9ef1c50167&srepoch=1706878918&all_sr_blocks=1444101_358173911_2_34_0&highlighted_blocks=1444101_358173911_2_34_0&matching_block_id=1444101_358173911_2_34_0&sr_pri_blocks=1444101_358173911_2_34_0__12510&from_sustainable_property_sr=1&from=searchresults#hotelTmpl,"El Hotel Turia se encuentra junto a la estación de autobuses de Valencia y a 350 metros de la estación de metro Turia. El alojamiento está situado frente al jardín del Turia y el jardín botánico de Valencia, a 20 minutos a pie de la catedral.

Todas las habitaciones del Turia Hotel disponen de aire acondicionado y TV. La mayoría están equipadas con balcón privado. Todas las habitaciones incluyen caja fuerte y baño privado con secador de pelo.

El hotel se halla frente al centro comercial Nuevo Centro y los grandes almacenes El Corte Inglés. El alojamiento también está bien comunicado en transporte público con la Ciudad de las Artes y las Ciencias, el aeropuerto y el centro de convenciones.

El Turia cuenta con bar, mostrador de información turística y recepción 24 horas.

Hay WiFi gratuita en todas las instalaciones. Se facilita aparcamiento por un suplemento.

Se están llevando a cabo obras de reforma en el hotel. Debido a ello, puede haber ruido durante el día."
Hotel RH Sorolla Centro,"8,8",¬ 153,https://www.booking.com/hotel/es/sorolla.es.html?label=gen173nr-1FCAEoggI46AdIClgEaEaIAQGYAQq4AQfIAQ_YAQHoAQH4AQKIAgGoAgO4ApfP860GwAIB0gIkOWNjMzhhYzktZmY4ZC00ZTYxLWE1OTgtMzU5MzQ4ZWY3ZGQ22AIF4AIB&aid=304142&ucfs=1&arphpl=1&checkin=2024-06-14&checkout=2024-06-15&dest_id=-406131&dest_type=city&group_adults=2&req_adults=2&no_rooms=1&group_children=0&req_children=0&hpos=21&hapos=21&sr_order=popularity&srpvid=48115b9ef1c50167&srepoch=1706878918&all_sr_blocks=9089621_347401057_0_2_0&highlighted_blocks=9089621_347401057_0_2_0&matching_block_id=9089621_347401057_0_2_0&sr_pri_blocks=9089621_347401057_0_2_0__15300&from_sustainable_property_sr=1&from=searchresults#hotelTmpl,"Este hotel se encuentra en una calle peatonal, a 200 metros de la estación de tren de Valencia y a solo 50 metros de la plaza del Ayuntamiento. El establecimiento ofrece habitaciones modernas equipadas con aire acondicionado, TV vía satélite y WiFi gratuita.

La recepción del Sorolla está abierta las 24 horas y cuenta con servicio de alquiler de bicicletas y coches. También hay mostrador de información turística.

El establecimiento sirve un desayuno buffet a diario de 07:30 a 11:00. El hotel está situado a pocos pasos de numerosas tiendas.

El Sorolla Centro goza de una ubicación céntrica, a poca distancia a pie de numerosos lugares turísticos de Valencia. Asimismo, el establecimiento se halla a solo 200 metros de la estación de metro Xàtiva."
Hotel Valencia Center,"8,1",¬ 170,https://www.booking.com/hotel/es/hotelescentervalencia.es.html?label=gen173nr-1FCAEoggI46AdIClgEaEaIAQGYAQq4AQfIAQ_YAQHoAQH4AQKIAgGoAgO4ApfP860GwAIB0gIkOWNjMzhhYzktZmY4ZC00ZTYxLWE1OTgtMzU5MzQ4ZWY3ZGQ22AIF4AIB&aid=304142&ucfs=1&arphpl=1&checkin=2024-06-14&checkout=2024-06-15&dest_id=-406131&dest_type=city&group_adults=2&req_adults=2&no_rooms=1&group_children=0&req_children=0&hpos=22&hapos=22&sr_order=popularity&srpvid=48115b9ef1c50167&srepoch=1706878918&all_sr_blocks=9128501_359468872_0_42_0&highlighted_blocks=9128501_359468872_0_42_0&matching_block_id=9128501_359468872_0_42_0&sr_pri_blocks=9128501_359468872_0_42_0__17000&from_sustainable_property_sr=1&from=searchresults#hotelTmpl,"El Hotel Valencia Center está a 400 metros de la Ciudad de las Artes y las Ciencias de Valencia y a 3 km del centro de la ciudad. Ofrece sauna, gimnasio y piscina al aire libre, y conexión WiFi gratuita.

El hotel se encuentra a 10 minutos a pie de la estación de metro de Ayora, que conecta con el centro de la ciudad y el aeropuerto. Se tarda 5 minutos en autobús a la playa o al centro de la ciudad, y hay una parada de autobús frente al hotel.

Todas las habitaciones tienen aire acondicionado/calefacción (según temporada), TV vía satélite, caja fuerte y minibar.

El restaurante del hotel ofrece platos de cocina mediterránea. También hay un bar y servicio de habitaciones.

La recepción permanece abierta las 24 horas y en el mostrador de información turística se alquilan coches. Se facilita aparcamiento por un suplemento."
SunDos Feria Valencia,"6,3",¬ 69,https://www.booking.com/hotel/es/sundos-feria-valencia.es.html?label=gen173nr-1FCAEoggI46AdIClgEaEaIAQGYAQq4AQfIAQ_YAQHoAQH4AQKIAgGoAgO4ApfP860GwAIB0gIkOWNjMzhhYzktZmY4ZC00ZTYxLWE1OTgtMzU5MzQ4ZWY3ZGQ22AIF4AIB&aid=304142&ucfs=1&arphpl=1&checkin=2024-06-14&checkout=2024-06-15&dest_id=-406131&dest_type=city&group_adults=2&req_adults=2&no_rooms=1&group_children=0&req_children=0&hpos=23&hapos=23&sr_order=popularity&srpvid=48115b9ef1c50167&srepoch=1706878918&all_sr_blocks=597692708_361901495_2_0_0&highlighted_blocks=597692708_361901495_2_0_0&matching_block_id=597692708_361901495_2_0_0&sr_pri_blocks=597692708_361901495_2_0_0__6900&from=searchresults#hotelTmpl,"SunDos Feria Valencia, que se encuentra a 7,6 km de Bioparc Valencia y a 7,8 km de Basílica de la Virgen de los Desamparados, ofrece habitaciones en Valencia. Este hotel de 2 estrellas ofrece salón de uso común, servicio de limpieza en seco y wifi gratis. Este alojamiento libre de humo está a 6,6 km de Church of Saint Nicolás.

Jardines de Monforte está a 7,8 km del alojamiento, y Jardín del Turia está a 7,9 km. El aeropuerto (Aeropuerto de Valencia) está a 8 km."
Malvarrosa Beach Rooms,"5,4",¬ 124,https://www.booking.com/hotel/es/chicote.es.html?label=gen173nr-1FCAEoggI46AdIClgEaEaIAQGYAQq4AQfIAQ_YAQHoAQH4AQKIAgGoAgO4ApfP860GwAIB0gIkOWNjMzhhYzktZmY4ZC00ZTYxLWE1OTgtMzU5MzQ4ZWY3ZGQ22AIF4AIB&aid=304142&ucfs=1&arphpl=1&checkin=2024-06-14&checkout=2024-06-15&dest_id=-406131&dest_type=city&group_adults=2&req_adults=2&no_rooms=1&group_children=0&req_children=0&hpos=24&hapos=24&sr_order=popularity&srpvid=48115b9ef1c50167&srepoch=1706878918&all_sr_blocks=31404805_350847176_2_0_0&highlighted_blocks=31404805_350847176_2_0_0&matching_block_id=31404805_350847176_2_0_0&sr_pri_blocks=31404805_350847176_2_0_0__12402&from=searchresults#hotelTmpl,"El Malvarrosa Beach Rooms se encuentra a solo 50 metros de la playa de Les Arenes de Valencia. Ofrece recepción las 24 horas y habitaciones con vistas al mar, WiFi gratuita y TV de pantalla plana.

Las habitaciones del Malvarrosa Beach Rooms presentan suelo de baldosa y una decoración sencilla. Todas tienen ventilador y baño privado, así como vistas frontales o laterales al mar.

El desayuno gratuito incluye café, zumo de naranja y tostadas o bollería.

El Malvarrosa Beach Rooms alberga un restaurante de comida mediterránea. En el puerto de la Copa América, ubicado a 5 minutos a pie, hay varios restaurantes.

La estación de metro Les Arenes está a solo 3 minutos a pie y conecta con el resto de la ciudad. La Ciudad de las Artes y las Ciencias se halla a 5 minutos en coche."
ibis budget Valencia Centro Puerto,"8,0",¬ 100,https://www.booking.com/hotel/es/ibis-budget-valencia-centro-puerto.es.html?label=gen173nr-1FCAEoggI46AdIClgEaEaIAQGYAQq4AQfIAQ_YAQHoAQH4AQKIAgGoAgO4ApfP860GwAIB0gIkOWNjMzhhYzktZmY4ZC00ZTYxLWE1OTgtMzU5MzQ4ZWY3ZGQ22AIF4AIB&aid=304142&ucfs=1&arphpl=1&checkin=2024-06-14&checkout=2024-06-15&dest_id=-406131&dest_type=city&group_adults=2&req_adults=2&no_rooms=1&group_children=0&req_children=0&hpos=25&hapos=25&sr_order=popularity&srpvid=48115b9ef1c50167&srepoch=1706878918&all_sr_blocks=1032575202_375944054_2_1_0&highlighted_blocks=1032575202_375944054_2_1_0&matching_block_id=1032575202_375944054_2_1_0&sr_pri_blocks=1032575202_375944054_2_1_0__9960&from_sustainable_property_sr=1&from=searchresults#hotelTmpl,"Ibis budget Valencia Centro Puerto está muy bien situado en el barrio de Poblados marítimos, Valencia, a 17 min a pie de Playa de las Arenas, a 2,6 km de Playa de la Malvarrosa y a 6 min a pie de Puerto de Valencia. Este hotel de 1 estrella ofrece salón de uso común y tiene habitaciones con aire acondicionado y baño privado. El hotel ofrece terraza y recepción 24 horas.

Las habitaciones de este alojamiento están equipadas con TV de pantalla plana. En el hotel, cada habitación está equipada con ropa de cama y toallas.

Ibis budget Valencia Centro Puerto ofrece desayuno buffet o continental.

Oceanográfico está a 3 km del alojamiento, y Jardín del Turia está a 3,6 km. El aeropuerto más cercano (Aeropuerto de Valencia) está a 13 km del alojamiento."
