Hotels,Ratings,Price,Link,Descriptions
Melia Valencia,"8,5",€ 140,https://www.booking.com/hotel/es/melia-valencia.es.html?label=gen173nr-1FCAEoggI46AdIClgEaEaIAQGYAQq4AQfIAQ_YAQHoAQH4AQKIAgGoAgO4AorS860GwAIB0gIkMGZmN2E5MjItMGE0My00YmMzLTkyYTUtNjBlMTkxMjk5YTcw2AIF4AIB&aid=304142&ucfs=1&arphpl=1&checkin=2024-06-16&checkout=2024-06-17&dest_id=-406131&dest_type=city&group_adults=2&req_adults=2&no_rooms=1&group_children=0&req_children=0&hpos=2&hapos=2&sr_order=popularity&srpvid=8fa55c57649d0123&srepoch=1706879286&all_sr_blocks=29049301_203994471_2_34_0&highlighted_blocks=29049301_203994471_2_34_0&matching_block_id=29049301_203994471_2_34_0&sr_pri_blocks=29049301_203994471_2_34_0__14000&nad_id=13d4f532-35f6-48cf-9edc-d1aefcb2d02a_0&nad_cpc=0.5&nad_track=eyJyYW5rIjoxLCJrb2RkaVRyYWNraW5nSW5mbyI6IlB5UlVqV1o1YjJKVy9iU0pEa0U0TGh3SkJvWWYvTlNGL2JGN0owckZKaER1VGZyTExTNXk0N1gwUjdlbGFqNytMOXl0RStBdU9TK3psNGgzcXl2Y01jVnQvbFZRVXZ6dFRTVndxbkpGSnVEZ0p5R2Y0cHVKb2tzSE1hd1FDR21nU09kaFJpQU9SUDRJWGxKRnE1eUN2S2RWKzIwakJuSnBzeHVtdFFJVmloODRnblkvWUF6OWEzQnhZcmt4RWRGNUJkajhaSVBWSWd2aUNQUjF6eTczMEZVNS82SlA5elRtL0tDeS9wQkx5WmN2QUlOV0RGVm9tN2ZDcWZ0R3RacHBiRS8waVJTblJLMEs2MEI0TWM5ZWdMMzhSTnZibWgrNC9pYkZnNy9xQVYxTEVQQjRzdjJxRkFmbFZXaVJJVDdnZ3RTWU5OWVdNd3hnRzc2YXFGaWFFWWh5VGpxbmVjZ0c0MGV6RCs1cEs5U1ZMNkhYTzE0Vk1QWEhySDlSWHRCSFlGU2JUSXlVaVBqWUwrTUZtcTNrOFlsY0lkeXdhMXpYdTd3VU95eFo5bitSWnkzd2lkbWMrWUNoUSt1Zk5JajBmRlNyN1JrRURJSXk0ekd4ZjNuVUpMc0o4NG9KaXIxby9SZ1l0bWNwR3lJOEs4U2FhZnc5eHI1bVppUm1OME8yWXhrRTd4OW1BWU9IdzhLWlRFemhYanZkMHE3eDNIWnNhODIyclpqOUFZYmMvZmZhVU1paUhJeGRNb0JpZzhaZVovSG9LeiswZ1pIcDlJanNOTDlNREVKQmRiYzkvS1Z0dW92U0RNdEdDMFBkNi8yWVpsRFI4aDAzQ09lbktYYjJYL1VUcThCMWxXUFdnUmh4cCs1VkFtRDRCZm8zY2psNVdGbUpFbUxCRDMwWm5GODFPTGFXOG5JRTkrcWhqR1h0bjBvMlVEdWJ4ekR6bTdudzFYcmlPZHB5aUxoYU1XYmdFc0Rqb1FPNFFMVFhRbHhWaGV4SW80Y0VqMkttMXowMFhNVm15QzJHcjU4SC9FZm5BbTN0KzJHa014Qml4RzRkTGd6NTVZSGJ1RDMrYWtNRkcxNGVubG1zUVFjdUxNYWUxSnFXYkRsV280ZUluNUZTRUtPOU1aZEY1bzYzOUppSzNHUmM5N253VVBwS0ZNNXJVVjl4Rm9YL1Y0ZU9QRkgwa1RNSGZrR29jWlBPSkcwSWxQK3l4UlBxR2xnMlpNMkd5alRmODh6UDFGcWdieDlqVGlXb01jcytRV3JqalhoTTJRaFI0MGw0VEZWQmVVemo2eGRVZ3kzVWVpZ0dqYTdCeG9qT0h3VFkrWThpYTdoZ0UvQmF3VlJqdUZYU2U0Ri91SHRhSEJnRlNUakFPdzVhWUZ4M1l0VlhSS1BwVGxjWUIwNWJTUHdwZm5STkRqZ3ljR0tYL0ZESy9yR1lkdVYzbm9DREtPVnFZTEFTRG1XVjlIUVp1Z2FHOFgxdkc4WnFGbXNyQ3JLeEp0WmZKNlJlL1Q3MUhvb1ZjTW9UbnR3QmVta0NTMnQrMkplZmcwenIwZ2VVeElYNmxVYUFsTE4vU0pQWllqbVJ6TDRraEV2dWRIdWw3MzFwSUt0ckdseDFaQjJ6UjFIR1FhMEFyb3RVRFdVWmJmamNORjg3WEZIY2VuSTdHT01xRmhCZ0NYQnZpejdzclA0N3B1VEQxTDNhVy9yZXB0Y0Z4V3RwOEFQbVBwVmN0dDQvYXM0RkxGWEY4N1FVeWQrZTZmbE4wOUdkUjI5OTZhdnZsWXdiM245K2tmZmgwNjVPN0pvMDFpUlcxLy9zRHhhdlNtb3JDWmszWTVUdEtPVVBQQWd3TC9RekYzOWNGSjBMd0ZUdGFBcnBpSTJFVmUrUmhDYmdQejNyc1BScWdFVllDZnNRTy80MU1wODFuWS9Qd0NBWE16S0xSZTBYUkhFaGhNbElpVnk0U0tKNldrekdhQ0JadklPUjNIc2pTVC9hNldORE0rRkpFcnZENy84ZUJEOWxjcUhzZXp3NStMK2R0ZXZ4TFYvUVR0ck9GTFhEczhVekF6aG5UL0RrNGVXQlIxUGhzQVI5dHdOUTJybXltTW40MzlNdkpKWWZRN3E1U3dEd2IzeC9pTnY2ckxvYkowL3E4M3RWMjVSZ2h0QXkzMXR4dkg0RkNDd05HN0pmRkRUdi94T1hCcG1TVlRDbjhQRTV2ZEJQNjZqSkdHMzN5QmdlNFJIQnB4Nkp4bjdZUXYvQVlOUVNHVjJhZ3pDTUFNQThGZ0U1MlFVMGVxVk5waTBBMjJ4TnpNNWdUbFJwL1JNaEd5NDd3NnVxUFhYQkZETHFpWTR5ZU53cmhzd3JBZkdKQ3d0Vyt4ZG1OSW5rNkM0amR0Y1JsMXk3T2dzL1ZtWVZiSWhnODFQd1d1N2ZWdHVRQk1FdGVQTDRqSmlOTUZmZzdsdmEvYUVkeXNmT2ZaS3lWQ2cxZ1ltYjZCT2NIVytGNVB0enExZzJjK2lQTlV2QUZFeDNreWUxMXR3b2p0SmQxTmsyZklUeTBQRFphcWJ1TlRha0swVFJNbExCblRubnF4ZGhWdFlRaytXaGpObEEvMDMvYWh5ZG9BZDZzMWx5RVJVbHdHR2xid0JiWGErRnUrdTlrMVNhNnloVm85alpzZ0Vid2FVR29CYUFzdE9aRTFad3l2YUNkbEpTWEoxeHNNbWwwZXVtZnNpbjExSlZ4bXlVenhuUTRsU29WejRRMkNZeUxFeTR0RHM1VDRYUjZvUWtSaU5sanhlcHNCVHg1N0ROWWYwdEowZTJFdnNSZVdodFI1ejlIVDhXZWVQM1hmRWF0dy81R2JRTVRFWm1CVkExay9GMXNhTUt4T3lEN0JRWnJ5MG90cXdwT1RpTmhBcUtEVHJwR2JoUjM0UXp5SHE3RU51VzhHeXVpRHRjemJDc2FZQ2hZRnFIWXphc3c5V2J2bGxFZTdTMElrUmJkelJGTkZScnU0YVFia2lZeFozQVVOaWxIQ21OdGFGVFp0S280MUVKWS92QzBJc0tRTnBXTCtyMmtlZ2VOSHRRKy9SK2o4NXVXNDBXZ0RydEt6RjBlb1pKK1F6RTQ5NktKMHN3QXJFa2x0MUFTczZ1b1JRL0RPa0haODNIOGtEcmUrR3pqbUo2NEtFQ2pCRkFiemRIQVN3WEtXZ3lzRE5XOXBPY2xtMU9qbXJuNXd0NDU5SEhyMEZzWVp1V1RFTldUZVJTQzcyaEdkeERUbTMyZkRlUzE0emJUYzRpVkZreEdRTT0ifQ%3D%3D&from_sustainable_property_sr=1&from=searchresults#hotelTmpl,"Este Meliá es un hotel moderno situado junto al Palacio de Congresos de Valencia, a 5 km de la estación de tren del AVE. La estación de metro de Beniferri se encuentra a solo 400 metros.

Las habitaciones son amplias y presentan un diseño moderno. Ofrecen unas vistas espectaculares y tienen TV de pantalla plana de 49 pulgadas con canales vía satélite. Todas disponen de aire acondicionado, WiFi gratuita y baño moderno.

El hotel cuenta con una zona de juegos infantiles. Hay salas de reuniones disponibles. Algunas zonas del hotel albergan habitaciones The Level y servicios exclusivos, como una zona privada para hacer el registro de entrada y de salida, desayuno buffet exclusivo, aperitivos y bebidas a diario en la zona privada y servicio de conserjería y organización de actividades en el hotel y la ciudad.

El aeropuerto internacional de Manises está a solo 15 minutos en coche del Meliá Valencia.

El hotel alberga el restaurante Socarrat, especializado en paellas valencianas y en cocina mediterránea e internacional. El bar Oval ofrece una pequeña carta de aperitivos y bebidas durante todo el día."
Eurostars Rey Don Jaime,"7,9",€ 88,https://www.booking.com/hotel/es/eurostars-rey-don-jaime.es.html?label=gen173nr-1FCAEoggI46AdIClgEaEaIAQGYAQq4AQfIAQ_YAQHoAQH4AQKIAgGoAgO4AorS860GwAIB0gIkMGZmN2E5MjItMGE0My00YmMzLTkyYTUtNjBlMTkxMjk5YTcw2AIF4AIB&aid=304142&ucfs=1&arphpl=1&checkin=2024-06-16&checkout=2024-06-17&dest_id=-406131&dest_type=city&group_adults=2&req_adults=2&no_rooms=1&group_children=0&req_children=0&hpos=3&hapos=3&sr_order=popularity&srpvid=8fa55c57649d0123&srepoch=1706879286&all_sr_blocks=9152023_88450508_2_34_0&highlighted_blocks=9152023_88450508_2_34_0&matching_block_id=9152023_88450508_2_34_0&sr_pri_blocks=9152023_88450508_2_34_0__8820&from_sustainable_property_sr=1&from=searchresults#hotelTmpl,"El Eurostars Rey Don Jaime se encuentra frente al Jardín del Turia y el Palau de la Música de Valencia. El establecimiento dispone de terraza en la azotea con piscina. Además, hay WiFi gratuita en todas las instalaciones.

El Rey Don Jaime alberga una torre impresionante de 14 plantas y ofrece habitaciones con aire acondicionado, calefacción y TV vía satélite (por un suplemento). También incluyen armario grande.

El hotel está situado a unos 15 minutos a pie de la Ciudad de las Artes y las Ciencias. Asimismo, el establecimiento se halla a 3,6 km del paseo marítimo de Valencia y de la playa más cercana. En la esquina del Eurostars Rey Don Jaime hay una parada de autobús local (línea 19) que proporciona conexiones con la playa y con el centro de la ciudad."
Ilunion Aqua 4,"8,1",€ 102,https://www.booking.com/hotel/es/confprtel-aqua-4.es.html?label=gen173nr-1FCAEoggI46AdIClgEaEaIAQGYAQq4AQfIAQ_YAQHoAQH4AQKIAgGoAgO4AorS860GwAIB0gIkMGZmN2E5MjItMGE0My00YmMzLTkyYTUtNjBlMTkxMjk5YTcw2AIF4AIB&aid=304142&ucfs=1&arphpl=1&checkin=2024-06-16&checkout=2024-06-17&dest_id=-406131&dest_type=city&group_adults=2&req_adults=2&no_rooms=1&group_children=0&req_children=0&hpos=4&hapos=4&sr_order=popularity&srpvid=8fa55c57649d0123&srepoch=1706879286&all_sr_blocks=9277701_385317700_0_2_0&highlighted_blocks=9277701_385317700_0_2_0&matching_block_id=9277701_385317700_0_2_0&sr_pri_blocks=9277701_385317700_0_2_0__10200&from_sustainable_property_sr=1&from=searchresults#hotelTmpl,"Este hotel de diseño está bien ubicado en Valencia, frente al Oceanogràfic y a la impresionante Ciudad de las Artes y las Ciencias. Hay wifi gratuita en todas las zonas.

Las habitaciones del Ilunion Aqua 4 presentan una decoración elegante en estilo moderno con colores cálidos y constan de suelo de madera y aire acondicionado. Incluyen escritorio grande, caja fuerte, minibar y TV de pantalla plana con canales vía satélite. Algunas habitaciones disfrutan de vistas panorámicas a la Ciudad de las Artes y las Ciencias. El baño presenta acabados de mármol y cuenta con secador de pelo y artículos de aseo gratuitos.

Por las mañanas se ofrece un desayuno variado. El establecimiento también sirve menús del día y a la carta para el almuerzo y la cena. Además, cuenta con productos especiales para celíacos y otras intolerancias alimentarias. El servicio de habitaciones está disponible en horario limitado.

Por su parte, el centro comercial Aqua Multiespacio alberga numerosas tiendas, un spa y un centro de fitness.

El Ilunion Aqua 4 está situado a 2 km del centro de Valencia y a 1 km del puerto. A 50 metros hay una parada de autobús que ofrece conexiones con el centro de la ciudad. Asimismo, el hotel se encuentra a pocos minutos en coche de las playas de la Malvarrosa y Las Arenas. El establecimiento también se halla a 20 minutos en coche del aeropuerto de Manises. Los huéspedes disfrutan de descuentos en el aparcamiento del centro comercial Aqua Multiespacio.

Este hotel está adaptado para personas con movilidad reducida y cuenta con la certificación oficial. Las habitaciones accesibles están disponibles bajo petición (también para personas con discapacidad auditiva o visual)."
Silken Puerta Valencia,"8,2",€ 95,https://www.booking.com/hotel/es/puertavalencia.es.html?label=gen173nr-1FCAEoggI46AdIClgEaEaIAQGYAQq4AQfIAQ_YAQHoAQH4AQKIAgGoAgO4AorS860GwAIB0gIkMGZmN2E5MjItMGE0My00YmMzLTkyYTUtNjBlMTkxMjk5YTcw2AIF4AIB&aid=304142&ucfs=1&arphpl=1&checkin=2024-06-16&checkout=2024-06-17&dest_id=-406131&dest_type=city&group_adults=2&req_adults=2&no_rooms=1&group_children=0&req_children=0&hpos=5&hapos=5&sr_order=popularity&srpvid=8fa55c57649d0123&srepoch=1706879286&all_sr_blocks=9118202_338926416_0_34_0&highlighted_blocks=9118202_338926416_0_34_0&matching_block_id=9118202_338926416_0_34_0&sr_pri_blocks=9118202_338926416_0_34_0__9500&from_sustainable_property_sr=1&from=searchresults#hotelTmpl,"El Silken Puerta Valencia se encuentra a 5 minutos a pie del estadio de Mestalla y a 15 minutos a pie de la Ciudad de las Artes y las Ciencias. Cuenta con conexión Wi-Fi gratuita y alberga un restaurante a la carta.

El Puerta Valencia, diseñado por Javier Mariscal, presenta un estilo elegante y contemporáneo. Las habitaciones son amplias y tienen aire acondicionado, suelo de parqué, TV vía satélite y escritorio.

El restaurante Puerta Valencia sirve una amplia variedad de platos mediterráneos y está especializado en arroces. También hay un bar que sirve tapas y cócteles por la noche.

El hotel cuenta con un aparcamiento amplio, disponible por un suplemento. La estación de metro más cercana es Aragón, situada a unos 400 metros. Desde allí podrá llegar en solo 10 minutos al casco antiguo y la catedral de la ciudad. La playa está a poco más de 2 km del Silken."
Eurostars Acteón,"8,4",€ 85,https://www.booking.com/hotel/es/eurostars-acteon.es.html?label=gen173nr-1FCAEoggI46AdIClgEaEaIAQGYAQq4AQfIAQ_YAQHoAQH4AQKIAgGoAgO4AorS860GwAIB0gIkMGZmN2E5MjItMGE0My00YmMzLTkyYTUtNjBlMTkxMjk5YTcw2AIF4AIB&aid=304142&ucfs=1&arphpl=1&checkin=2024-06-16&checkout=2024-06-17&dest_id=-406131&dest_type=city&group_adults=2&req_adults=2&no_rooms=1&group_children=0&req_children=0&hpos=6&hapos=6&sr_order=popularity&srpvid=8fa55c57649d0123&srepoch=1706879286&all_sr_blocks=9049501_88181818_2_34_0&highlighted_blocks=9049501_88181818_2_34_0&matching_block_id=9049501_88181818_2_34_0&sr_pri_blocks=9049501_88181818_2_34_0__8550&from_sustainable_property_sr=1&from=searchresults#hotelTmpl,"El Eurostars Acteón está a 15 minutos a pie de la Ciudad de las Artes y las Ciencias de Valencia. En el hotel hay WiFi gratuita. 

Las habitaciones son amplias, están insonorizadas y cuentan con ventanas grandes, aire acondicionado, TV vía satélite, escritorio y caja fuerte. El baño privado incluye bañera, secador de pelo y toallero eléctrico.

Hay un bar cafetería y en el restaurante se sirve comida mediterránea. También se prepara a diario un desayuno buffet y hay servicio de habitaciones. Además, los huéspedes reciben una bebida de bienvenida.

En la recepción 24 horas del Eurostars Acteón se ofrecen coches y bicicletas de alquiler. También se facilita aparcamiento por un suplemento.

Frente al hotel paran autobuses que comunican con el centro de Valencia, situado a 5 minutos en coche. La estación de metro de Ayora está a 650 metros. La playa de La Malvarrosa y el puerto deportivo Juan Carlos I quedan a 3 minutos en coche. Los centros comerciales Aqua y El Saler se sitúan a 15 minutos a pie."
Eurostars Gran Valencia,"8,5",€ 85,https://www.booking.com/hotel/es/eurostars-gran-valencia.es.html?label=gen173nr-1FCAEoggI46AdIClgEaEaIAQGYAQq4AQfIAQ_YAQHoAQH4AQKIAgGoAgO4AorS860GwAIB0gIkMGZmN2E5MjItMGE0My00YmMzLTkyYTUtNjBlMTkxMjk5YTcw2AIF4AIB&aid=304142&ucfs=1&arphpl=1&checkin=2024-06-16&checkout=2024-06-17&dest_id=-406131&dest_type=city&group_adults=2&req_adults=2&no_rooms=1&group_children=0&req_children=0&hpos=7&hapos=7&sr_order=popularity&srpvid=8fa55c57649d0123&srepoch=1706879286&all_sr_blocks=9048401_88181781_2_34_0&highlighted_blocks=9048401_88181781_2_34_0&matching_block_id=9048401_88181781_2_34_0&sr_pri_blocks=9048401_88181781_2_34_0__8460&from_sustainable_property_sr=1&from=searchresults#hotelTmpl,"Este moderno establecimiento se encuentra junto al centro de congresos de Valencia y ofrece vistas al centro de la ciudad y WiFi gratuita. El Eurostars cuenta con centro de fitness, sauna y piscina en la azotea.

Todas las habitaciones del Gran Valencia cuentan con aire acondicionado, TV de pantalla plana vía satélite, caja fuerte y minibar.

Además, hay un bar, y el restaurante sirve platos de cocina típica mediterránea, como marisco fresco. Hay servicio de habitaciones y se sirve un desayuno para llevar en la habitación.

El Eurostars Gran Valencia ofrece un servicio de lavandería y limpieza en seco. El centro histórico de Valencia está a 3 km y en las inmediaciones hay paradas de autobús, tren y metro."
Alojamiento con habitaciones dobles y baño privado,"8,7",€ 40,https://www.booking.com/hotel/es/your-perfectt-place.es.html?label=gen173nr-1FCAEoggI46AdIClgEaEaIAQGYAQq4AQfIAQ_YAQHoAQH4AQKIAgGoAgO4AorS860GwAIB0gIkMGZmN2E5MjItMGE0My00YmMzLTkyYTUtNjBlMTkxMjk5YTcw2AIF4AIB&aid=304142&ucfs=1&arphpl=1&checkin=2024-06-16&checkout=2024-06-17&dest_id=-406131&dest_type=city&group_adults=2&req_adults=2&no_rooms=1&group_children=0&req_children=0&hpos=8&hapos=8&sr_order=popularity&srpvid=8fa55c57649d0123&srepoch=1706879286&all_sr_blocks=1056836607_377867387_2_0_0&highlighted_blocks=1056836607_377867387_2_0_0&matching_block_id=1056836607_377867387_2_0_0&sr_pri_blocks=1056836607_377867387_2_0_0__4000&from_sustainable_property_sr=1&from=searchresults#hotelTmpl,"Alojamiento con habitaciones dobles y baño privado se encuentra a 2,5 km de Jardines de Monforte y ofrece alojamiento consalón de uso común, terraza y cocina compartida. Hay wifi gratis en todo el alojamiento.

El alojamiento tiene aire acondicionado, cocina totalmente equipada y con zona de comedor, TV de pantalla plana y baño privado con ducha, artículos de aseo gratuitos y secador de pelo. También se ofrece nevera, horno y microondas, además de cafetera y hervidor.

Church of Saint Nicolás está a 2,7 km del alojamiento, y Basílica de la Virgen de los Desamparados está a 1,9 km. El aeropuerto más cercano (Aeropuerto de Valencia) está a 13 km."
Sweet Hotel Continental,"8,1",€ 109,https://www.booking.com/hotel/es/continental.es.html?label=gen173nr-1FCAEoggI46AdIClgEaEaIAQGYAQq4AQfIAQ_YAQHoAQH4AQKIAgGoAgO4AorS860GwAIB0gIkMGZmN2E5MjItMGE0My00YmMzLTkyYTUtNjBlMTkxMjk5YTcw2AIF4AIB&aid=304142&ucfs=1&arphpl=1&checkin=2024-06-16&checkout=2024-06-17&dest_id=-406131&dest_type=city&group_adults=2&req_adults=2&no_rooms=1&group_children=0&req_children=0&hpos=9&hapos=9&sr_order=popularity&srpvid=8fa55c57649d0123&srepoch=1706879286&all_sr_blocks=9385605_261898914_0_2_0&highlighted_blocks=9385605_261898914_0_2_0&matching_block_id=9385605_261898914_0_2_0&sr_pri_blocks=9385605_261898914_0_2_0__10900&from=searchresults#hotelTmpl,"El Hotel Continental se encuentra en el centro de Valencia, a 5 minutos a pie de la estación de tren Estació del Nord, junto a la plaza principal de la ciudad. El establecimiento ofrece recepción 24 horas y habitaciones con TV vía satélite.

El hotel sirve un desayuno continental diario en la sala de desayunos y está a 5 minutos a pie de varios restaurantes de calidad.

La terraza tiene vistas a la ciudad y está equipada con mesas y sillas.

El personal de la recepción del Continental Hotel puede facilitar información turística sobre Valencia. Las calles comerciales Colón y Poeta Querol se encuentran a menos de 5 minutos a pie del hotel."
Olympia Consul del Mar,"7,9",€ 65,https://www.booking.com/hotel/es/casual-valencia-de-las-artes.es.html?label=gen173nr-1FCAEoggI46AdIClgEaEaIAQGYAQq4AQfIAQ_YAQHoAQH4AQKIAgGoAgO4AorS860GwAIB0gIkMGZmN2E5MjItMGE0My00YmMzLTkyYTUtNjBlMTkxMjk5YTcw2AIF4AIB&aid=304142&ucfs=1&arphpl=1&checkin=2024-06-16&checkout=2024-06-17&dest_id=-406131&dest_type=city&group_adults=2&req_adults=2&no_rooms=1&group_children=0&req_children=0&hpos=10&hapos=10&sr_order=popularity&srpvid=8fa55c57649d0123&srepoch=1706879286&all_sr_blocks=53805601_88501820_0_2_0&highlighted_blocks=53805601_88501820_0_2_0&matching_block_id=53805601_88501820_0_2_0&sr_pri_blocks=53805601_88501820_0_2_0__6500&from=searchresults#hotelTmpl,"El Olympia Consul del Mar se encuentra a 15 minutos a pie de la Ciudad de las Artes y las Ciencias. Ofrece WiFi gratuita.

Las habitaciones son amplias y disponen de aire acondicionado, minibar, caja fuerte y TV de pantalla plana. El baño privado incluye secador de pelo y artículos de aseo gratuitos. Una de las habitaciones está adaptada para personas con movilidad reducida.

Hay numerosos bares, restaurantes y tiendas en los alrededores del Olympia Consul del Mar. El centro histórico de Valencia, situado a 3 km, también alberga muchos sitios para comer y animados locales de ocio nocturno.

La estación de metro Amistat, situada a 10 minutos a pie del hotel, ofrece conexiones con el resto de la ciudad. Se encuentra a 3 km del puerto de Valencia y de la playa. El aeropuerto de Valencia queda a 20 minutos en coche. Se facilita aparcamiento privado por un suplemento."
Hotel Dimar,"8,6",€ 99,https://www.booking.com/hotel/es/dimar.es.html?label=gen173nr-1FCAEoggI46AdIClgEaEaIAQGYAQq4AQfIAQ_YAQHoAQH4AQKIAgGoAgO4AorS860GwAIB0gIkMGZmN2E5MjItMGE0My00YmMzLTkyYTUtNjBlMTkxMjk5YTcw2AIF4AIB&aid=304142&ucfs=1&arphpl=1&checkin=2024-06-16&checkout=2024-06-17&dest_id=-406131&dest_type=city&group_adults=2&req_adults=2&no_rooms=1&group_children=0&req_children=0&hpos=11&hapos=11&sr_order=popularity&srpvid=8fa55c57649d0123&srepoch=1706879286&all_sr_blocks=9088602_91462763_0_2_0&highlighted_blocks=9088602_91462763_0_2_0&matching_block_id=9088602_91462763_0_2_0&sr_pri_blocks=9088602_91462763_0_2_0__9900&from_sustainable_property_sr=1&from=searchresults#hotelTmpl,"Este moderno hotel de diseño está situado en la plaza Cánovas de Valencia y ofrece un gimnasio y conexión Wi-Fi gratuita. Todas las habitaciones del Hotel Dimar son elegantes e incluyen set de té y café y TV de pantalla plana.

Las habitaciones del Hotel Dimar presentan una decoración elegante y cuentan con aire acondicionado, suelo de madera, minibar y baño privado con artículos de aseo y secador de pelo.

El restaurante del Hotel Dimar sirve un desayuno bufé continental y el bar ofrece bocadillos y pastas. Además, en los alrededores hay varios restaurantes y bares.

El Hotel Dimar está situado junto al jardín del Turia, a 15 minutos a pie de la catedral de Valencia y a 600 metros de la estación de metro de Colón. La famosa Ciudad de las Artes y las Ciencias se halla a solo 1,5 km."
Quart Youth Hostel & Apartments,"7,7",€ 61,https://www.booking.com/hotel/es/quart-youth-hostel.es.html?label=gen173nr-1FCAEoggI46AdIClgEaEaIAQGYAQq4AQfIAQ_YAQHoAQH4AQKIAgGoAgO4AorS860GwAIB0gIkMGZmN2E5MjItMGE0My00YmMzLTkyYTUtNjBlMTkxMjk5YTcw2AIF4AIB&aid=304142&ucfs=1&arphpl=1&checkin=2024-06-16&checkout=2024-06-17&dest_id=-406131&dest_type=city&group_adults=2&req_adults=2&no_rooms=1&group_children=0&req_children=0&hpos=12&hapos=12&sr_order=popularity&srpvid=8fa55c57649d0123&srepoch=1706879286&all_sr_blocks=47641801_88209789_0_2_0&highlighted_blocks=47641801_88209789_0_2_0&matching_block_id=47641801_88209789_0_2_0&sr_pri_blocks=47641801_88209789_0_2_0__6124&from=searchresults#hotelTmpl,"El Quart Youth Hostel, situado a 300 metros de las torres medievales de Quart, ofrece consigna de equipaje y conexión WiFi gratuitas. Las habitaciones tienen taquillas individuales y adaptadores eléctricos.

Presentan una decoración moderna y cuentan con armario, ventilador de techo, camas individuales o literas, y baño compartido con ducha o bañera.

El Quart Youth Hostel sirve un desayuno buffet diario y cuenta con máquinas expendedoras de aperitivos y bebidas. También alberga una cocina compartida con tostadora, hervidor de agua y cafetera.

El Quart Youth Hostel se encuentra en el centro de la ciudad, a 5 minutos a pie del casco antiguo de Valencia, y está muy bien comunicado con la red de transporte público. A 150 metros hay una parada de autobús que lleva tanto a la Ciudad de las Artes y las Ciencias como a las playas de Valencia."
Host & Home,"8,4",€ 90,https://www.booking.com/hotel/es/host-amp-home.es.html?label=gen173nr-1FCAEoggI46AdIClgEaEaIAQGYAQq4AQfIAQ_YAQHoAQH4AQKIAgGoAgO4AorS860GwAIB0gIkMGZmN2E5MjItMGE0My00YmMzLTkyYTUtNjBlMTkxMjk5YTcw2AIF4AIB&aid=304142&ucfs=1&arphpl=1&checkin=2024-06-16&checkout=2024-06-17&dest_id=-406131&dest_type=city&group_adults=2&req_adults=2&no_rooms=1&group_children=0&req_children=0&hpos=13&hapos=13&sr_order=popularity&srpvid=8fa55c57649d0123&srepoch=1706879286&all_sr_blocks=166378511_89492930_0_0_0&highlighted_blocks=166378511_89492930_0_0_0&matching_block_id=166378511_89492930_0_0_0&sr_pri_blocks=166378511_89492930_0_0_0__8984&from=searchresults#hotelTmpl,"Host & Home está muy bien situado en el barrio de Ciutat Vella, Valencia, a 7 min a pie de Church of Saint Nicolás, a 1,1 km de Jardín del Turia y a 1 min a pie de Museo Nacional de Cerámica y Artes Santuarias González Martí. Este alojamiento está muy cerca de lugares de interés como Basílica de la Virgen de los Desamparados, Jardines de Monforte y Plaza del Ayuntamiento. El alojamiento está a 200 metros del centro de la ciudad y a menos de 1 km de Estación de tren del Norte.

El hostal o pensión ofrece habitaciones con aire acondicionado, escritorio, hervidor, caja fuerte, TV de pantalla plana y baño privado con ducha. Hay wifi gratis, y algunas de las habitaciones también incluyen balcón. En Host & Home, las habitaciones incluyen ropa de cama y toallas.

Bioparc Valencia está a 4,7 km del alojamiento, y Oceanográfico está a 5,8 km. El aeropuerto (Aeropuerto de Valencia) está a 8 km."
Hotel Olympia Universidades,"8,4",€ 85,https://www.booking.com/hotel/es/universidades.es.html?label=gen173nr-1FCAEoggI46AdIClgEaEaIAQGYAQq4AQfIAQ_YAQHoAQH4AQKIAgGoAgO4AorS860GwAIB0gIkMGZmN2E5MjItMGE0My00YmMzLTkyYTUtNjBlMTkxMjk5YTcw2AIF4AIB&aid=304142&ucfs=1&arphpl=1&checkin=2024-06-16&checkout=2024-06-17&dest_id=-406131&dest_type=city&group_adults=2&req_adults=2&no_rooms=1&group_children=0&req_children=0&hpos=14&hapos=14&sr_order=popularity&srpvid=8fa55c57649d0123&srepoch=1706879286&all_sr_blocks=130173102_85709815_0_2_0&highlighted_blocks=130173102_85709815_0_2_0&matching_block_id=130173102_85709815_0_2_0&sr_pri_blocks=130173102_85709815_0_2_0__8500&from_sustainable_property_sr=1&from=searchresults#hotelTmpl,"El Hotel Olympia Universidades ofrece habitaciones modernas y WiFi gratuita en todas sus instalaciones. El hotel está situado a 10 metros de la estación de metro de Benimaclet, que comunica con la playa, el centro y el aeropuerto de Valencia.

Las habitaciones exteriores del Hotel Olympia Universidades están insonorizadas y disponen de aire acondicionado, TV de pantalla plana de 32 pulgadas y baño privado con ducha y artículos de aseo gratuitos. Algunas tienen vistas a la ciudad.

El Hotel Olympia Universidades proporciona servicio de alquiler de bicicletas y queda a 5 minutos a pie de varios bares y restaurantes y los Jardines del Real.

El establecimiento está a 10 minutos en tranvía de la estación del Norte de Valencia, a 12 km del aeropuerto y a 10 metros de la parada de tranvía más cercana, que comunica con la playa de La Malvarrosa en menos de 15 minutos."
