Hotels,Ratings,Price,Link,Descriptions
Ilunion Aqua 3,"7,8",€ 95,https://www.booking.com/hotel/es/confortel-aqua-3.es.html?label=gen173nr-1FCAEoggI46AdIClgEaEaIAQGYAQq4AQfIAQ_YAQHoAQH4AQKIAgGoAgO4AorS860GwAIB0gIkMGZmN2E5MjItMGE0My00YmMzLTkyYTUtNjBlMTkxMjk5YTcw2AIF4AIB&aid=304142&ucfs=1&arphpl=1&checkin=2024-06-16&checkout=2024-06-17&dest_id=-406131&dest_type=city&group_adults=2&req_adults=2&no_rooms=1&group_children=0&req_children=0&hpos=15&hapos=15&sr_order=popularity&srpvid=8fa55c57649d0123&srepoch=1706879286&all_sr_blocks=9277601_385353786_0_2_0&highlighted_blocks=9277601_385353786_0_2_0&matching_block_id=9277601_385353786_0_2_0&sr_pri_blocks=9277601_385353786_0_2_0__9480&from_sustainable_property_sr=1&from=searchresults#hotelTmpl,"El hotel de diseño Ilunion Aqua 3 está situado en Valencia, a solo 300 metros de la Ciudad de las Artes y las Ciencias y del Oceanogràfic. Ofrece habitaciones modernas, recepción 24 horas y WiFi gratuita.

El establecimiento está ubicado sobre el centro comercial Aqua Multiespacio, que alberga un multicine, una amplia gama de tiendas de ropa, un spa y un centro de fitness.

Las habitaciones del Ilunion Aqua 3 tienen aire acondicionado, suelo de madera y una decoración moderna en colores cálidos. Además, incluyen escritorio, caja fuerte y TV vía satélite de pantalla plana. El baño cuenta con acabados de mármol, secador de pelo y artículos de aseo gratuitos.

El establecimiento alberga un restaurante moderno y luminoso, en el que se sirve el desayuno todas las mañanas. El restaurante también ofrece menús fijos y a la carta para el almuerzo y la cena, y menús especiales para personas alérgicas.

A solo 50 metros del establecimiento hay una parada de autobús que comunica de forma regular con el centro de la ciudad y la playa. Las playas de la Malvarrosa y Las Arenas están a solo unos minutos en coche del establecimiento, y el aeropuerto de Manises queda a 20 minutos en coche. Los huéspedes disfrutan de descuentos en el aparcamiento del centro comercial Aqua Multiespacio.

El establecimiento está oficialmente adaptado para personas con discapacidad.

Los huéspedes pueden hacer el registro de salida después de lo habitual, hasta las 12:00, de forma gratuita."
Port Feria Valencia,"8,0",€ 63,https://www.booking.com/hotel/es/port-valencia-feria.es.html?label=gen173nr-1FCAEoggI46AdIClgEaEaIAQGYAQq4AQfIAQ_YAQHoAQH4AQKIAgGoAgO4AorS860GwAIB0gIkMGZmN2E5MjItMGE0My00YmMzLTkyYTUtNjBlMTkxMjk5YTcw2AIF4AIB&aid=304142&ucfs=1&arphpl=1&checkin=2024-06-16&checkout=2024-06-17&dest_id=-406131&dest_type=city&group_adults=2&req_adults=2&no_rooms=1&group_children=0&req_children=0&hpos=16&hapos=16&sr_order=popularity&srpvid=8fa55c57649d0123&srepoch=1706879286&all_sr_blocks=9285201_372552674_2_2_0&highlighted_blocks=9285201_372552674_2_2_0&matching_block_id=9285201_372552674_2_2_0&sr_pri_blocks=9285201_372552674_2_2_0__6293&from_sustainable_property_sr=1&from=searchresults#hotelTmpl,"El Port Feria Valencia, situado cerca del Centro de Convenciones Feria Valencia y muy cerca del centro de la ciudad, es la mejor opción para descubrir Valencia gracias a sus excelentes conexiones con todos las zonas de la ciudad, sus completas instalaciones y sus servicios de calidad. Este hotel moderno está muy bien comunicado con el centro histórico, la plaza del Ayuntamiento, el aeropuerto y la Ciudad de las Artes y las Ciencias.

El Port Feria Valencia ofrece servicios excelentes y prácticos. Alberga un restaurante a la carta con platos mediterráneos y especialidades valencianas. Cuenta con piscina al aire libre, terraza solárium, gimnasio, restaurante y cafetería. Hay WiFi gratuita en todas las zonas del hotel. El aparcamiento y el servicio de enlace con el aeropuerto conllevan un suplemento.

El Port Feria Valencia ofrece habitaciones espléndidas con todas las comodidades necesarias para garantizar una estancia inmejorable. Cuenta con 3 salas para reuniones con una capacidad máxima de 78 personas, entre otros servicios e instalaciones.

La estación de metro de Benimàmet queda a 400 metros. El hotel está bien comunicado con las principales carreteras. El aeropuerto de Valencia se encuentra a 10 minutos en coche."
Hotel Valencia Center,"8,1",€ 115,https://www.booking.com/hotel/es/hotelescentervalencia.es.html?label=gen173nr-1FCAEoggI46AdIClgEaEaIAQGYAQq4AQfIAQ_YAQHoAQH4AQKIAgGoAgO4AorS860GwAIB0gIkMGZmN2E5MjItMGE0My00YmMzLTkyYTUtNjBlMTkxMjk5YTcw2AIF4AIB&aid=304142&ucfs=1&arphpl=1&checkin=2024-06-16&checkout=2024-06-17&dest_id=-406131&dest_type=city&group_adults=2&req_adults=2&no_rooms=1&group_children=0&req_children=0&hpos=17&hapos=17&sr_order=popularity&srpvid=8fa55c57649d0123&srepoch=1706879286&all_sr_blocks=9128501_0_2_0_0&highlighted_blocks=9128501_0_2_0_0&matching_block_id=9128501_0_2_0_0&sr_pri_blocks=9128501_0_2_0_0__11476&from_sustainable_property_sr=1&from=searchresults#hotelTmpl,"El Hotel Valencia Center está a 400 metros de la Ciudad de las Artes y las Ciencias de Valencia y a 3 km del centro de la ciudad. Ofrece sauna, gimnasio y piscina al aire libre, y conexión WiFi gratuita.

El hotel se encuentra a 10 minutos a pie de la estación de metro de Ayora, que conecta con el centro de la ciudad y el aeropuerto. Se tarda 5 minutos en autobús a la playa o al centro de la ciudad, y hay una parada de autobús frente al hotel.

Todas las habitaciones tienen aire acondicionado/calefacción (según temporada), TV vía satélite, caja fuerte y minibar.

El restaurante del hotel ofrece platos de cocina mediterránea. También hay un bar y servicio de habitaciones.

La recepción permanece abierta las 24 horas y en el mostrador de información turística se alquilan coches. Se facilita aparcamiento por un suplemento."
Hostal On Dormire Valencia,"7,1",€ 63,https://www.booking.com/hotel/es/on-dormire-valencia.es.html?label=gen173nr-1FCAEoggI46AdIClgEaEaIAQGYAQq4AQfIAQ_YAQHoAQH4AQKIAgGoAgO4AorS860GwAIB0gIkMGZmN2E5MjItMGE0My00YmMzLTkyYTUtNjBlMTkxMjk5YTcw2AIF4AIB&aid=304142&ucfs=1&arphpl=1&checkin=2024-06-16&checkout=2024-06-17&dest_id=-406131&dest_type=city&group_adults=2&req_adults=2&no_rooms=1&group_children=0&req_children=0&hpos=18&hapos=18&sr_order=popularity&srpvid=8fa55c57649d0123&srepoch=1706879286&all_sr_blocks=43230501_373984702_0_0_0&highlighted_blocks=43230501_373984702_0_0_0&matching_block_id=43230501_373984702_0_0_0&sr_pri_blocks=43230501_373984702_0_0_0__6325&from_sustainable_property_sr=1&from=searchresults#hotelTmpl,"Este establecimiento se encuentra en la avenida Ausiàs March de Valencia, a 15 minutos a pie de la plaza de toros y de la estación Estació del Nord. Ofrece habitaciones elegantes con aire acondicionado y WiFi gratuita.

Las habitaciones del On Dormire Valencia están situadas en la 6ª planta de un edificio y presentan una decoración en tonos blanco y gris. Disponen de TV vía satélite y baño privado.

El personal de recepción puede proporcionar información turística sobre Valencia. El establecimiento está cerca de numerosos bares y restaurantes. La impresionante Ciudad de las Artes y las Ciencias se halla a 20 minutos a pie. Frente al On Dormire Valencia paran autobuses urbanos de servicio regular."
Hotel Medium Valencia,"8,1",€ 99,https://www.booking.com/hotel/es/medium-valencia.es.html?label=gen173nr-1FCAEoggI46AdIClgEaEaIAQGYAQq4AQfIAQ_YAQHoAQH4AQKIAgGoAgO4AorS860GwAIB0gIkMGZmN2E5MjItMGE0My00YmMzLTkyYTUtNjBlMTkxMjk5YTcw2AIF4AIB&aid=304142&ucfs=1&arphpl=1&checkin=2024-06-16&checkout=2024-06-17&dest_id=-406131&dest_type=city&group_adults=2&req_adults=2&no_rooms=1&group_children=0&req_children=0&hpos=19&hapos=19&sr_order=popularity&srpvid=8fa55c57649d0123&srepoch=1706879286&all_sr_blocks=9683801_88196453_0_2_0&highlighted_blocks=9683801_88196453_0_2_0&matching_block_id=9683801_88196453_0_2_0&sr_pri_blocks=9683801_88196453_0_2_0__9900&from_sustainable_property_sr=1&from=searchresults#hotelTmpl,"Este hotel de diseño situado a 700 metros de la impresionante Ciudad de las Artes y las Ciencias de Valencia ofrece un gimnasio y una piscina al aire libre de temporada. Las habitaciones son amplias e incluyen conexión Wi-Fi gratuita y TV de pantalla plana vía satélite.

Todas las habitaciones del Medium Valencia presentan suelos de madera y una decoración elegante. Están equipadas con aire acondicionado y baño privado con artículos de aseo y secador de pelo. Algunas tienen vistas espectaculares a la Ciudad de las Artes y las Ciencias.

El restaurante del Hotel Medium Valencia sirve cocina mediterránea. El hotel también tiene un bar salón en el vestíbulo.

El Medium Valencia se encuentra a unos 2,5 km del centro histórico de Valencia y a 4 km de las playas de la ciudad. Ofrece aparcamiento privado; además, cerca del hotel hay paradas de autobús con servicios frecuentes."
Primus Valencia,"8,2",€ 104,https://www.booking.com/hotel/es/primus-valencia.es.html?label=gen173nr-1FCAEoggI46AdIClgEaEaIAQGYAQq4AQfIAQ_YAQHoAQH4AQKIAgGoAgO4AorS860GwAIB0gIkMGZmN2E5MjItMGE0My00YmMzLTkyYTUtNjBlMTkxMjk5YTcw2AIF4AIB&aid=304142&ucfs=1&arphpl=1&checkin=2024-06-16&checkout=2024-06-17&dest_id=-406131&dest_type=city&group_adults=2&req_adults=2&no_rooms=1&group_children=0&req_children=0&hpos=20&hapos=20&sr_order=popularity&srpvid=8fa55c57649d0123&srepoch=1706879286&all_sr_blocks=33187101_88154952_0_2_0&highlighted_blocks=33187101_88154952_0_2_0&matching_block_id=33187101_88154952_0_2_0&sr_pri_blocks=33187101_88154952_0_2_0__10425&from_sustainable_property_sr=1&from=searchresults#hotelTmpl,"Este hotel ultramoderno se encuentra a solo 600 metros de la impresionante Ciudad de las Artes y las Ciencias de Valencia. Además, cuenta con un spa, gimnasio, piscina exterior disponible todo el año y habitaciones elegantes con TV de plasma vía satélite y WiFi gratuita.

Las habitaciones del Valencia Primus están insonorizadas y cuentan con aire acondicionado, suelo de madera, una decoración moderna y luminosa, escritorio y caja fuerte para un ordenador portátil.

Por un suplemento, los huéspedes podrán acceder al completo spa del hotel, provisto de piscina dinámica, piscina de agua fría, bañera de hidromasaje, sauna, hammam y una amplia gama de masajes y tratamientos de belleza. Se ofrece una amplia gama de masajes y tratamientos de belleza por un suplemento. También hay un centro de fitness.

El elegante restaurante del hotel sirve cocina tradicional mediterránea con un toque moderno. El alojamiento dispone de una terraza al aire libre, así como de un bar-cafetería con vistas al encantador jardín.

El centro comercial Aqua Multiespacio está justo frente al Primus Valencia. Hay un autobús que para a 75 metros y comunica con el centro de la ciudad y las playas."
"Holiday Inn Express Ciudad de las Ciencias, an IHG Hotel","8,0",€ 120,https://www.booking.com/hotel/es/express-by-holiday-inn-ciudad-de-las-ciencias.es.html?label=gen173nr-1FCAEoggI46AdIClgEaEaIAQGYAQq4AQfIAQ_YAQHoAQH4AQKIAgGoAgO4AorS860GwAIB0gIkMGZmN2E5MjItMGE0My00YmMzLTkyYTUtNjBlMTkxMjk5YTcw2AIF4AIB&aid=304142&ucfs=1&arphpl=1&checkin=2024-06-16&checkout=2024-06-17&dest_id=-406131&dest_type=city&group_adults=2&req_adults=2&no_rooms=1&group_children=0&req_children=0&hpos=21&hapos=21&sr_order=popularity&srpvid=8fa55c57649d0123&srepoch=1706879286&all_sr_blocks=9673715_246097028_2_1_8&highlighted_blocks=9673715_246097028_2_1_8&matching_block_id=9673715_246097028_2_1_8&sr_pri_blocks=9673715_246097028_2_1_8__12000&from=searchresults#hotelTmpl,"El Express by Holiday Inn Ciudad de las Ciencias se encuentra a 5 minutos a pie de la Ciudad de las Artes y las Ciencias de Valencia. Ofrece WiFi gratuita y piscina exterior de temporada con tumbonas.

Todas las habitaciones del Holiday Inn disponen de aire acondicionado y baño privado con secador de pelo. También incluyen una TV vía satélite y un escritorio.

El desayuno se sirve en el comedor con vistas a la zona de la piscina. El hotel tiene una recepción 24 horas y un mostrador de información turística cuyo personal puede proporcionar información sobre Valencia y sus alrededores.

El Express by Holiday Inn está bien comunicado con la autopista V30 y se encuentra detrás del centro comercial El Saler. Los autobuses que van hasta el centro de la ciudad salen de una parada situada a 5 minutos a pie."
One Shot Colón 46,"8,1",€ 113,https://www.booking.com/hotel/es/one-shot-colon-46.es.html?label=gen173nr-1FCAEoggI46AdIClgEaEaIAQGYAQq4AQfIAQ_YAQHoAQH4AQKIAgGoAgO4AorS860GwAIB0gIkMGZmN2E5MjItMGE0My00YmMzLTkyYTUtNjBlMTkxMjk5YTcw2AIF4AIB&aid=304142&ucfs=1&arphpl=1&checkin=2024-06-16&checkout=2024-06-17&dest_id=-406131&dest_type=city&group_adults=2&req_adults=2&no_rooms=1&group_children=0&req_children=0&hpos=22&hapos=22&sr_order=popularity&srpvid=8fa55c57649d0123&srepoch=1706879286&all_sr_blocks=139416801_258838072_0_0_0&highlighted_blocks=139416801_258838072_0_0_0&matching_block_id=139416801_258838072_0_0_0&sr_pri_blocks=139416801_258838072_0_0_0__11250&from_sustainable_property_sr=1&from=searchresults#hotelTmpl,"El One Shot Colón 46, ubicado a 10 minutos a pie de la catedral de Valencia, ofrece habitaciones con aire acondicionado y conexión WiFi gratuita en todas las instalaciones.

Todas las habitaciones, con una decoración moderna, cuentan con TV de pantalla plana, escritorio y armario. Algunas disponen además de balcón y vistas a la ciudad. Los baños privados están equipados con artículos de aseo gratuitos y secador de pelo.

El establecimiento alberga una recepción abierta las 24 horas y un mostrador de información turística.

El Mercado Central se encuentra a 900 metros del One Shot Colón 46, mientras que la Ciudad de las Artes y las Ciencias está a 12 minutos en coche. El aeropuerto de Valencia se sitúa a 15 minutos en coche."
One Shot Palacio Reina Victoria 04,"8,2",€ 140,https://www.booking.com/hotel/es/one-shot-palacio-reina-victoria.es.html?label=gen173nr-1FCAEoggI46AdIClgEaEaIAQGYAQq4AQfIAQ_YAQHoAQH4AQKIAgGoAgO4AorS860GwAIB0gIkMGZmN2E5MjItMGE0My00YmMzLTkyYTUtNjBlMTkxMjk5YTcw2AIF4AIB&aid=304142&ucfs=1&arphpl=1&checkin=2024-06-16&checkout=2024-06-17&dest_id=-406131&dest_type=city&group_adults=2&req_adults=2&no_rooms=1&group_children=0&req_children=0&hpos=23&hapos=23&sr_order=popularity&srpvid=8fa55c57649d0123&srepoch=1706879286&all_sr_blocks=9088508_258832435_0_0_0&highlighted_blocks=9088508_258832435_0_0_0&matching_block_id=9088508_258832435_0_0_0&sr_pri_blocks=9088508_258832435_0_0_0__13950&from_sustainable_property_sr=1&from=searchresults#hotelTmpl,"El One Shot Palacio Reina Victoria 04, situado en el centro de Valencia, junto a la plaza del Ayuntamiento, es un hotel elegante que ofrece habitaciones amplias con aire acondicionado. Además, hay WiFi gratuita en todas las instalaciones.

Todas las habitaciones incluyen TV de pantalla plana de 48 pulgadas, calefacción, caja fuerte, minibar y baño privado con bañera o ducha de efecto lluvia, secador de pelo y artículos de aseo gratuitos. La mayoría tiene vistas a la calle.

El One Shot Palacio Reina Victoria 04 está a 10 minutos a pie de la catedral de Valencia y la Llotja de la Seda, declarada Patrimonio de la Humanidad por la UNESCO. La Ciudad de las Artes y las Ciencias queda a menos de 3 km.

Desde las estaciones de metro de Xàtiva y Colón, ubicadas a 5 minutos a pie del hotel, se llega directamente al aeropuerto de Valencia en 20 minutos."
Sercotel Sorolla Palace,"8,3",€ 106,https://www.booking.com/hotel/es/sorolla-palace.es.html?label=gen173nr-1FCAEoggI46AdIClgEaEaIAQGYAQq4AQfIAQ_YAQHoAQH4AQKIAgGoAgO4AorS860GwAIB0gIkMGZmN2E5MjItMGE0My00YmMzLTkyYTUtNjBlMTkxMjk5YTcw2AIF4AIB&aid=304142&ucfs=1&arphpl=1&checkin=2024-06-16&checkout=2024-06-17&dest_id=-406131&dest_type=city&group_adults=2&req_adults=2&no_rooms=1&group_children=0&req_children=0&hpos=24&hapos=24&sr_order=popularity&srpvid=8fa55c57649d0123&srepoch=1706879286&all_sr_blocks=9364601_98672341_2_2_0&highlighted_blocks=9364601_98672341_2_2_0&matching_block_id=9364601_98672341_2_2_0&sr_pri_blocks=9364601_98672341_2_2_0__10560&from_sustainable_property_sr=1&from=searchresults#hotelTmpl,"El Sorolla Palace ofrece un alojamiento elegante ubicado a 50 metros del Palacio de Congresos de Valencia. Dispone de una terraza preciosa con piscina al aire libre y ofrece bañera de hidromasaje, gimnasio y WiFi gratuita.

Las habitaciones del Sercotel tienen una decoración luminosa y atractiva e incluyen aire acondicionado y TV de pantalla plana vía satélite. Las plantas superiores del Sorolla Palace tienen vistas impresionantes a la ciudad. La piscina exterior cuenta con un techo retráctil que la cubre en invierno, primavera y otoño.

En la cafetería L'Estany se sirven tapas y una gran variedad de cócteles, así como platos mediterráneos e internacionales.

El Sercotel Sorolla Palace se encuentra a 5 minutos a pie de la estación de metro de Beniferri, que conecta en 9 paradas con la Ciudad de las Artes y las Ciencias. El parque de Beniferri está a solo 100 metros del alojamiento."
Ilunion Valencia 4,"8,0",€ 108,https://www.booking.com/hotel/es/confortel-valencia.es.html?label=gen173nr-1FCAEoggI46AdIClgEaEaIAQGYAQq4AQfIAQ_YAQHoAQH4AQKIAgGoAgO4AorS860GwAIB0gIkMGZmN2E5MjItMGE0My00YmMzLTkyYTUtNjBlMTkxMjk5YTcw2AIF4AIB&aid=304142&ucfs=1&arphpl=1&checkin=2024-06-16&checkout=2024-06-17&dest_id=-406131&dest_type=city&group_adults=2&req_adults=2&no_rooms=1&group_children=0&req_children=0&hpos=25&hapos=25&sr_order=popularity&srpvid=8fa55c57649d0123&srepoch=1706879286&all_sr_blocks=75432901_385265993_0_2_0&highlighted_blocks=75432901_385265993_0_2_0&matching_block_id=75432901_385265993_0_2_0&sr_pri_blocks=75432901_385265993_0_2_0__10800&from_sustainable_property_sr=1&from=searchresults#hotelTmpl,"El Ilunion Valencia 4 se encuentra en Valencia, a solo 800 metros del palacio de congresos y a 3 minutos a pie de la parada de metro Beniferri, y dispone de piscina al aire libre y WiFi gratuita en todas las instalaciones.

Las habitaciones presentan una decoración en tonos cálidos y constan de aire acondicionado, zona de estar integrada y TV de pantalla plana con canales vía satélite. También incluye sofá, nevera y caja fuerte. El baño privado cuenta con secador de pelo y artículos de aseo gratuitos. Algunas habitaciones ofrecen impresionantes vistas a la ciudad.

El Ilunion Valencia 4 sirve un desayuno diario y ofrece platos a la carta. Los huéspedes pueden acceder a la piscina de temporada. Se facilita aparcamiento privado por un suplemento.

Este hotel está oficialmente adaptado para personas con discapacidad. Alberga habitaciones adaptadas para personas con discapacidad o discapacidad auditiva/visual, disponibles bajo petición.

A menos de 15 minutos a pie del Ilunion Valencia 4 hay un centro comercial y numerosos restaurantes. El hotel se sitúa a 3 km del centro histórico de Valencia y a 15 minutos en coche de la playa de la Malvarrosa. El aeropuerto de Valencia está a 40 minutos en metro.

Se aplican suplementos por noche. Los huéspedes que viajen con mascotas deberán ponerse en contacto con el hotel para comprobar y confirmar la disponibilidad de la habitación. El hotel comprobará la disponibilidad y si la habitación cumple con las especificaciones necesarias. Solo se admiten mascotas en las habitaciones dobles aptas para mascotas. En las otras habitaciones no se admiten mascotas. Una vez en el establecimiento, los huéspedes recibirán las normas de acceso, que deberán leer y aceptar.

El aparcamiento se reserva al llegar al hotel y está sujeto a disponibilidad."
Ilunion Valencia 3,"7,7",€ 99,https://www.booking.com/hotel/es/confortel-valencia-3.es.html?label=gen173nr-1FCAEoggI46AdIClgEaEaIAQGYAQq4AQfIAQ_YAQHoAQH4AQKIAgGoAgO4AorS860GwAIB0gIkMGZmN2E5MjItMGE0My00YmMzLTkyYTUtNjBlMTkxMjk5YTcw2AIF4AIB&aid=304142&ucfs=1&arphpl=1&checkin=2024-06-16&checkout=2024-06-17&dest_id=-406131&dest_type=city&group_adults=2&req_adults=2&no_rooms=1&group_children=0&req_children=0&hpos=26&hapos=26&sr_order=popularity&srpvid=8fa55c57649d0123&srepoch=1706879286&all_sr_blocks=9281810_385294585_0_2_0&highlighted_blocks=9281810_385294585_0_2_0&matching_block_id=9281810_385294585_0_2_0&sr_pri_blocks=9281810_385294585_0_2_0__9900&from_sustainable_property_sr=1&from=searchresults#hotelTmpl,"El Ilunion Valencia 3 cuenta con piscina al aire libre y WiFi gratuita en todas las instalaciones. Se encuentra a 800 metros del centro de congresos.

Las habitaciones del Ilunion Valencia 3 presentan una decoración de estilo nórdico en colores claros y disponen de aire acondicionado y suelo de parquet. También incluyen TV de pantalla plana con canales vía satélite y baño con ducha, artículos de aseo gratuitos y secador de pelo. Algunas habitaciones ofrecen vistas impresionantes a la ciudad.

El Ilunion Valencia 3 sirve desayunos buffet a diario y prepara platos a la carta, entre ellos paella valenciana típica. Además, se preparan menús especiales para celíacos y personas con intolerancias alimentarias. El establecimiento alberga una terraza junto a la piscina.

El Ilunion Valencia 3 se encuentra a menos de 10 minutos a pie de un centro comercial y diversos restaurantes. La estación de metro Beniferri se encuentra a 250 metros y hay una parada de autobús cercana que enlaza con el centro de la ciudad de Valencia en menos de 10 minutos.

Se facilita aparcamiento privado por un suplemento.

Licencia de alquiler HO03/2012/13"
ABCyou Bed&Breakfast,"8,8",€ 89,https://www.booking.com/hotel/es/abc-bnb-2-0.es.html?label=gen173nr-1FCAEoggI46AdIClgEaEaIAQGYAQq4AQfIAQ_YAQHoAQH4AQKIAgGoAgO4AorS860GwAIB0gIkMGZmN2E5MjItMGE0My00YmMzLTkyYTUtNjBlMTkxMjk5YTcw2AIF4AIB&aid=304142&ucfs=1&arphpl=1&checkin=2024-06-16&checkout=2024-06-17&dest_id=-406131&dest_type=city&group_adults=2&req_adults=2&no_rooms=1&group_children=0&req_children=0&hpos=1&hapos=1&sr_order=popularity&srpvid=8fa55c57649d0123&srepoch=1706879286&all_sr_blocks=18920701_265523021_2_2_0&highlighted_blocks=18920701_265523021_2_2_0&matching_block_id=18920701_265523021_2_2_0&sr_pri_blocks=18920701_265523021_2_2_0__8900&from=searchresults#hotelTmpl,"El ABCyou Bed&Breakfast es un establecimiento que ofrece calidad a buen precio, se encuentra justo en el corazón de Valencia y ofrece habitaciones con aire acondicionado, conexión Wi-Fi gratuita y baño privado. Queda a solo 5 minutos a pie de la plaza de toros y de la estación Estació del Nord.

Las habitaciones del ABCyou Bed&Breakfast tienen suelo de mosaico tradicional, decoración luminosa y ventanas grandes que ofrecen mucha luz natural.

Los huéspedes pueden disfrutar del desayuno en el salón cafetería del ABC, pasar una mañana tranquila en el jardín y disfrutar de una copa de vino o una cerveza por la tarde en el bar.

Los huéspedes podrán disfrutar por la noche de los restaurantes y tiendas elegantes del barrio moderno de Ruzafa en Valencia, o también relajarse en las habitaciones tranquilas del establecimiento."
